{
  "schema_version": "hum.math_result.v0",
  "result_id": "hum_res_allocation_free_push_byte",
  "obligation_id": "hum_obl_allocation_free_push_byte",
  "created_at": "2026-07-07T00:00:00.000Z",
  "status": "proved",
  "trust_label": "proved",
  "evidence_classes": ["static_proof", "checkable_trace"],
  "proof_certificate": {
    "certificate_kind": "static_analysis_certificate",
    "checker": "truth-harness-hum-static-v0",
    "artifact_ref": ".hum/evidence/hum_obl_allocation_free_push_byte.certificate.json",
    "artifact_sha256": null
  },
  "checkable_trace": {
    "trace_kind": "static_analyzer_trace",
    "steps": [
      "Inspect semantic graph node hum_sem_node_push_byte.",
      "Find no heap allocation effects in the reachable local call graph.",
      "Confirm allowed effects are limited to read_memory and write_local_memory."
    ],
    "replay_command": "truth-harness hum verify fixtures/hum/proved_allocation_free.json --out .hum/evidence/"
  },
  "counterexample": null,
  "assumptions_used": ["assume_fixed_buffer_capacity"],
  "model_limitations": [
    "This proves allocation freedom only for the exported Hum semantic graph and resource model."
  ],
  "confidence_level": "machine_checked",
  "source_spans_affected": [
    {
      "file": "src/buffer.hum",
      "start_line": 12,
      "start_column": 1,
      "end_line": 19,
      "end_column": 2
    }
  ],
  "suggested_hum_evidence_artifact": {
    "artifact_kind": "hum_evidence_report",
    "path": ".hum/evidence/hum_obl_allocation_free_push_byte.json",
    "summary": "Allocation freedom proved by a local static trace."
  },
  "llm_proof_accepted": false,
  "privacy": {
    "local_first": true,
    "network_access": "none",
    "cloud_access": "none",
    "telemetry": "none"
  }
}
